<?xml version="1.0" encoding="UTF-8"?>
<partie xmlns:xsi="http://www.w3.org/2001/XMLSchema-instance" xsi:noNamespaceSchemaLocation="NAW_TP5_Bataille_Schema_Element.xsd">
	<joueur id="Joueur1">
		<grilleD>
			<caseD col="2" lig="B" etat="0" taille_bateau="5"/>
			<caseD col="3" lig="B" etat="0" taille_bateau="5"/>
			<caseD col="4" lig="B" etat="0" taille_bateau="5"/>
			<caseD col="5" lig="B" etat="0" taille_bateau="5"/>
			<caseD col="6" lig="B" etat="0" taille_bateau="5"/>
			<caseD col="2" lig="F" etat="0" taille_bateau="4"/>
			<caseD col="2" lig="G" etat="0" taille_bateau="4"/>
			<caseD col="2" lig="H" etat="0" taille_bateau="4"/>
			<caseD col="2" lig="I" etat="0" taille_bateau="4"/>
			<caseD col="6" lig="E" etat="0" taille_bateau="3"/>
			<caseD col="7" lig="E" etat="0" taille_bateau="3"/>
			<caseD col="8" lig="E" etat="0" taille_bateau="3"/>
			<caseD col="8" lig="H" etat="0" taille_bateau="2"/>
			<caseD col="8" lig="I" etat="0" taille_bateau="2"/>
			<caseD col="2" lig="D" etat="0" taille_bateau="1"/>
		</grilleD>
		<joue can="1"/>
	</joueur>
	<joueur id="Joueur2">
		<grilleD>
			<caseD col="9" lig="B" etat="0" taille_bateau="5"/>
			<caseD col="9" lig="C" etat="0" taille_bateau="5"/>
			<caseD col="9" lig="D" etat="0" taille_bateau="5"/>
			<caseD col="9" lig="E" etat="0" taille_bateau="5"/>
			<caseD col="9" lig="F" etat="0" taille_bateau="5"/>
			<caseD col="3" lig="F" etat="0" taille_bateau="4"/>
			<caseD col="4" lig="F" etat="0" taille_bateau="4"/>
			<caseD col="5" lig="F" etat="0" taille_bateau="4"/>
			<caseD col="6" lig="F" etat="0" taille_bateau="4"/>
			<caseD col="4" lig="C" etat="0" taille_bateau="3"/>
			<caseD col="5" lig="C" etat="0" taille_bateau="3"/>
			<caseD col="6" lig="C" etat="0" taille_bateau="3"/>
			<caseD col="9" lig="H" etat="0" taille_bateau="2"/>
			<caseD col="9" lig="I" etat="0" taille_bateau="2"/>
			<caseD col="5" lig="H" etat="0" taille_bateau="1"/>
		</grilleD>
		<joue can="0"/>
	</joueur>
	<tour nb="0"/>
</partie>
